german,german example,english,english example
der Schinken, –,Ich möchte gern ein Schinkenbrot.,ham,I would like a ham roll.
der Schluss,Ich muss jetzt Schluss machen.,…,I need to finish/wrap up now.
der Schluss,Zum Schluss gibt er uns allen die Hand.,end,At the end, he shakes everyone’s hand.
der Schlüssel, –,Ich gebe Ihnen noch den Zimmerschlüssel.,key,I’ll give you the room key as well.
der Schrank, -ä, e,Die Gläser stehen im Schrank.,cupboard,The glasses are in the cupboard.
der Schuh, -e,Zieh die Schuhe aus!,shoe,Take your shoes off!
die Schule,Meine Tochter geht schon in die Schule.,school,My daughter is already going to school.
die Schule,Die Schule ist gleich hier um die Ecke.,school,The school is right around the corner.
der Schüler, –,In meinem Kurs sind acht Schülerinnen und fünf Schüler.,pupil,In my course there are 8 female pupils and 5 male pupils.
die Schwester, -n,Meine Schwester kommt am Dienstag.,sister,My sister is coming on Tuesday.
das Schwimmbad,Kommst du mit ins Schwimmbad?,swimming pool,Are you coming to the swimming pool with us?
der See,Komm, wir fahren zum Starnberger See.,lake,Come, we’re going to Starnberg lake.
die Sehenswürdigkeit, -en,Welche Sehenswürdigkeiten gibt es in Frankfurt?,sights/attractions,Which sights are there to see in Frankfurt?
das Sofa,Das Sofa ist neu.,sofa,The sofa is new.
der Sohn, -ö, e,Das ist Hans, mein Sohn.,son,That is Hans, my son.
die Sonne,Die Sonne scheint.,sun,The sun is shining.
die Speisekarte,Bringen Sie mir die Speisekarte, bitte.,menu,Bring me the menu, please.
der Sport,Ich mache viel Sport.,sport,I do a lot of sport.
die Sprache, -n,Welche Sprachen sprichst du?,language,Which languages do you speak?
die Stadt, -ä, e,Heidelberg ist eine alte Stadt.,town / city,Heidelberg is an old town.
die Stelle, -n,Ich habe eine neue Stelle.,job / position,I have a new job.
der Stock,Unsere Wohnung liegt im ersten Stock.,floor (of a building),Our flat is on the first floor.
die Straße, -n,In welcher Straße wohnen Sie?,street,Which street do you live on?
die Straßenbahn,Wo fährt die Straßenbahn ab?,tram,From where does the tram depart?
das Studium,Das Studium beginnt im Oktober.,degree course,The degree course begins in October.
der Student, -en,Ich bin Studentin.,student,I am a student.
die Stunde, -n,Ich bin in einer Stunde zurück.,hour,I will be back in an hour.
die Tasche, -n,Ich habe die Schlüssel in der Tasche.,bag,I have the key in the bag.
das Taxi, -s,Es gibt heute keinen Bus mehr. Er fährt mit dem Taxi.,taxi,There are no more buses today. He is travelling by taxi.
der Tee,Ich trinke morgens immer Tee.,tea,I always drink tea in the morning.
der Teil, -e,Lies bitte auch den zweiten Teil.,part,Please also read the second part.
das Telefon,Haben Sie ein Telefon?,telephone,Do you have a telephone?
der Termin, -e,Am besten machen wir sofort einen Termin.,appointment,It's best to make an appointment immediately.
der Test,Der Test war einfach.,test,The test was simple.
der Text, -e,Lesen Sie bitte diesen Text.,text,Please read this text.
das Thema,Wir sprechen heute über das Thema „Essen und Trinken“.,topic,Today we are talking about the topic “Food and Drink”.
das Ticket, -s,Wie viel kostet das Ticket?,ticket,How much does the ticket cost?
der Tisch, -e,Die Fotos liegen auf dem Tisch.,table,The photos are on the table.
die Tochter, -ö,Das ist meine Tochter Katharina.,daughter,That is my daughter Katharina.
die Toilette, -en,Wo ist die Toilette, bitte?,toilet,Where is the toilet, please?
die Tomate, -n,Die Tomate ist noch grün.,tomato,The tomato is still green.
die Treppe, -n,Die Toilette? Die Treppe hoch und dann links.,stairs,The toilet? Up the stairs and then left.
die Uhr,Es ist vier Uhr.,o'clock / am / pm,It is four o’clock.
der Unterricht,Wir haben Unterricht von 8:00 bis 12:00 Uhr.,class,We have classes from 8 am until 12 pm.
die Unterschrift,Hier fehlt noch Ihre Unterschrift.,signature,Your signature is missing here.
der Urlaub,Ich nehme im September Urlaub.,holiday,I’m taking holiday in September.
der Vater, -ä,Mein Vater ist Arbeiter.,father,My father is a worker.
der Verein,Es gibt einen neuen Sportverein in der Stadt.,club,There is a new sports club in the town.
der Verkäufer, –,Meine Mutter ist Verkäuferin im Kaufhaus.,salesperson,My mother is a saleswoman in a department store.
der Vermieter,Unser Vermieter heißt Huber. Er wohnt auch hier.,landlord,Our landlord is called Huber. He lives here, too.
der Verwandte, -n,Peter besucht seine Verwandten in Polen.,relative,Peter visits his relatives in Poland.
der Vorname, -n,Ich heiße Müller, mein Vorname ist Eva.,first name,I’m called Müller, my first name is Eva.
die Vorsicht,Vorsicht! Da kommt ein Auto.,…,Careful! There’s a car coming.
die Vorsicht,Er arbeitet mit Vorsicht.,attention,He works with caution.
die Vorwahl,Wie ist die Vorwahl von München?,area code,What is the area code for Munich?
das Wasser,Ein Glas Wasser, bitte.,water,A glass of water, please.
der Wein,Nein danke, ich möchte keinen Wein.,wine,No thank you, I don’t want any wine.
die Welt,Es gibt viele Probleme auf der Welt.,world,There are many problems in the world.
das Wetter,Wir hatten schlechtes Wetter.,weather,We had bad weather.
das Wiederhören,Auf Wiederhören!,…,Goodbye!
das Wiedersehen,Auf Wiedersehen!,…,Goodbye!
der Wind,Der Wind kommt aus Osten.,wind,The wind is coming from the east.
die Wohnung, -en,Seit wann haben Sie diese Wohnung?,flat,How long have you had this flat?
das Wort, -ö, er/-e,Ich kenne das Wort nicht.,word,I don’t know that word.
die Zeit,Ich habe heute keine Zeit.,time,I have no time today
die Zeitung, -en,Ich lese gern Zeitung.,newspaper,I like to read the newspaper.
die Zigarette, -n,Wie teuer sind die Zigaretten?,cigarette,How expensive are the cigarettes?
das Zimmer, –,Das Zimmer ist groß.,room,The room is large.
das Zimmer, –,Öffne im Schlafzimmer das Fenster, bitte!,room,Open the window in the bedroom, please!
das Zimmer, –,Die Wohnung hat drei Zimmer.,room,The flat has three rooms.
das Zimmer, –,Ich habe ein Zimmer bestellt.,room,I have booked a room.
der Zoll,Wir müssen noch durch den Zoll.,customs,We still need to go through customs.
der Zug, -ü, e,Ich fahre gern mit dem Zug.,train,I like to travel by train.
die Nummer, -n,Sie haben Zimmer Nummer zwölf.,number,You have room number twelve.
